"File Name","Main mission","Sub mission","Academic Summary","Link sub folder","","","","","","","","","","","","","","","","","","","","",""
"รวมเล่มคู่มือการใช้คู่มือนิเทศการวิจัยในชั้นเรียน.pdf","กลุ่มที่ 1: การพัฒนานวัตกรรมและองค์ความรู้เฉพาะทางในการนิเทศการศึกษา","1.1 เอกสารวิชาการประเภท ""คู่มือและแนวทางการนิเทศ""","เอกสารแนวทางการใช้คู่มือนิเทศการวิจัยในชั้นเรียนจำนวน 12 เล่ม สำหรับศึกษานิเทศก์และครูผู้สอนระดับประถมศึกษา นำเสนอกระบวนการอย่างเป็นระบบ ตั้งแต่วินิจฉัยปัญหาจนถึงการประเมินรายงานวิจัย เพื่อให้ครูนำไปจัดกิจกรรมการเรียนรู้โดยมีวิจัยเป็นฐาน","https://drive.google.com/file/d/1-l7z6Rj2BeN3XA5hcj8tY_HfCdJc-2XH/view?usp=sharing","","","","","","","","","","","","","","","","","","","","",""
"รวมเล่มคู่มือประกอบการนิเทศการวัดผลในชั้นเรียน.pdf","กลุ่มที่ 1: การพัฒนานวัตกรรมและองค์ความรู้เฉพาะทางในการนิเทศการศึกษา","1.1 เอกสารวิชาการประเภท ""คู่มือและแนวทางการนิเทศ""","คู่มือแนวทางการขับเคลื่อนการนิเทศผ่านชุดคู่มือวัดผลในชั้นเรียน 12 เล่ม มุ่งพัฒนาศักยภาพครูประถมศึกษากรณีการสร้างและประเมินคุณภาพเครื่องมือวัดผล (พุทธิพิสัย จิตพิสัย ทักษะพิสัย) เพื่อปรับปรุงกระบวนการออกแบบการวัดและประเมินผลให้ตรงตามหลักวิชา","https://drive.google.com/file/d/1ibJAZ5_DFNkldptdJoGkFsSUKxGp35hQ/view?usp=sharing","","","","","","","","","","","","","","","","","","","","",""
"รวมเล่มแนวทางการบูรณาการและ AL.pdf","กลุ่มที่ 2: การพัฒนาวิชาชีพและหนุนเสริมศักยภาพครูผ่านกระบวนการนิเทศแบบร่วมมือ","2.1 หลักสูตรและสื่อการพัฒนาวิชาชีพครู (เช่น เอกสารประกอบการจัดเวิร์กชอป)","กรอบแนวคิดและกรณีศึกษาการจัดการเรียนรู้เชิงรุก (Active Learning) บนสถานการณ์จริงเพื่อบ่มเพาะคุณลักษณะนวัตกรเยาวชน 5 ประการ ผ่านนวัตกรรมการศึกษา 5 มิติ โดยกำหนดบทบาทพฤติกรรมบ่งชี้ชัดเจนของครูในการจัดสภาพแวดล้อมเชิงนิเวศเพื่อสร้างนวัตกร","https://drive.google.com/file/d/1_Cpj6eycfA72_c6Z94SymAxYMLNmBG7X/view?usp=sharing","","","","","","","","","","","","","","","","","","","","",""
"รวมเล่มแนวทางการสร้างวัฒนธรรมการขับเคลื่อนด้วยข้อมูลในสถานศึกษา.pdf","กลุ่มที่ 3: การบริหารจัดการเครือข่ายและประสานความร่วมมือเพื่อการพัฒนาการศึกษาเชิงพื้นที่","3.3 รายงานผลการดำเนินงานเชิงระบบและสารสนเทศเพื่อการตัดสินใจของผู้บริหาร","คู่มือเชิงกลยุทธ์ในการเปลี่ยนผ่านระบบสถานศึกษาไปสู่องค์กรที่ตัดสินใจด้วยข้อมูล (Data-Driven Decision Making) โดยขับเคลื่อนผ่านรากฐาน 3 ประการ (คุณภาพ ขีดความสามารถ วัฒนธรรม) และ 4 เสาหลัก เพื่อเลี่ยงการใช้ข้อมูลแบบผิวเผินและยกระดับผลลัพธ์ผู้เรียนเชิงระบบ","https://drive.google.com/file/d/1Wu-V7X9L_FGmvtGC7FhA6_2CK3ocwMIn/view?usp=sharing","","","","","","","","","","","","","","","","","","","","",""
"รวมเล่มแนวทางการนิเทศเพื่อรอบรับประเมินภาพนอก ขั้นพื้นฐาน final.pdf","กลุ่มที่ 1: การพัฒนานวัตกรรมและองค์ความรู้เฉพาะทางในการนิเทศการศึกษา","1.1 เอกสารวิชาการประเภท ""คู่มือและแนวทางการนิเทศ""","กรอบแนวทางการนิเทศสถานศึกษาขั้นพื้นฐาน 3 มาตรฐาน 16 ตัวชี้วัด ภายใต้โมเดล MSDLK และแนวคิด Assessment for Learning ขับเคลื่อนร่องรอยหลักฐานเชิงประจักษ์ (SAR) ผ่านการบูรณาการเทคโนโลยี NotebookLM เพื่อลดภาระงานเอกสาร","https://drive.google.com/file/d/1QrI3Fqbvx3-nRBiZwy-kk_NjMR3GqVus/view?usp=sharing","","","","","","","","","","","","","","","","","","","","",""
"รวมเล่มแนวทางการนิเทศเพื่อรอบรับประเมินภาพนอกระดับปฐมวัย.pdf","กลุ่มที่ 1: การพัฒนานวัตกรรมและองค์ความรู้เฉพาะทางในการนิเทศการศึกษา","1.1 เอกสารวิชาการประเภท ""คู่มือและแนวทางการนิเทศ""","คู่มือการนิเทศยกระดับคุณภาพสถานศึกษาปฐมวัยรองรับการประเมิน สมศ. มุ่งเน้นการพัฒนาองค์รวม (Holistic Development) ทักษะสมอง EF และ Play-based Learning ควบคู่กับการใช้เทคโนโลยีวิเคราะห์ ""กระจกสะท้อนการสอน"" ของครู","https://drive.google.com/file/d/13rdcvMvqt8eMQb4XkUP-9Nm8jt7onIAk/view?usp=sharing","","","","","","","","","","","","","","","","","","","","",""
"แนวทางการประเมินผลการเรียนรู้ของผู้เรียนภายใต้สถานการณ์ปัญญาประดิษฐ์","กลุ่มที่ 3: การบริหารจัดการเครือข่ายและประสานความร่วมมือเพื่อการพัฒนาการศึกษาเชิงพื้นที่","3.3 รายงานผลการดำเนินงานเชิงระบบและสารสนเทศเพื่อการตัดสินใจของผู้บริหาร","รายงานเชิงสถิติและการสังเคราะห์ความคิดเห็นผู้บริหารและครู 384 คน ผ่าน AI (Gemini Pro) นำเสนอภาพรวมทัศนคติเชิงบวกต่อการปรับเปลี่ยนระบบวัดผลสู่ Competency & Hybrid Assessment พร้อมข้อเสนอแนะเชิงนโยบายและแนวปฏิบัติเชิงพื้นที่ในการหนุนเสริมจริยธรรม AI และเครื่องมือลดภาระงานครู","https://drive.google.com/file/d/1kyzAxO9HlOA2n_XdhompbZNdwyvsPR7X/view?usp=sharing","","","","","","","","","","","","","","","","","","","","",""
"การออกแบบการประเมินสมรรถนะของผู้เรียนโดยใช้วันไหว้ครูเป็นฐาน","กลุ่มที่ 2: การพัฒนาวิชาชีพและหนุนเสริมศักยภาพครูผ่านกระบวนการนิเทศแบบร่วมมือ","2.1 หลักสูตรและสื่อการพัฒนาวิชาชีพครู (เช่น เอกสารประกอบการจัดเวิร์กชอป)","สื่อนำเสนอโครงการเวิร์กชอปเรื่อง ""การออกแบบการประเมินสมรรถนะของผู้เรียนโดยใช้วันไหว้ครูเป็นฐาน"" โดยศึกษานิเทศก์ รัชภูมิ สมสมัย มุ่งเน้นการเชื่อมโยงความรู้ ประสบการณ์ และชีวิตจริง เพื่อปรับเปลี่ยนแนวทางการวัดผลเชิงรุก","https://canva.link/grx1xss1bkogle3","","","","","","","","","","","","","","","","","","","","",""
"การออกแบบนวัตกรรมการศึกษาบนฐานผลการประเมินระดับห้องเรียน / ระดับชาติ และบริบทพื้นถิ่นอำเภอเชียงดาว","กลุ่มที่ 2: การพัฒนาวิชาชีพและหนุนเสริมศักยภาพครูผ่านกระบวนการนิเทศแบบร่วมมือ","2.1 หลักสูตรและสื่อการพัฒนาวิชาชีพครู (เช่น เอกสารประกอบการจัดเวิร์กชอป)","สื่อนำเสนอโครงการเวิร์กชอปเรื่อง ""การออกแบบการประเมินสมรรถนะของผู้เรียนโดยใช้วันไหว้ครูเป็นฐาน"" โดยศึกษานิเทศก์ รัชภูมิ สมสมัย มุ่งเน้นการเชื่อมโยงความรู้ ประสบการณ์ และชีวิตจริง เพื่อปรับเปลี่ยนแนวทางการวัดผลเชิงรุก","https://canva.link/ehihansjmh55md4","","","","","","","","","","","","","","","","","","","","",""
"แนวทางการประเมินสมรรถนะของผู้เรียนที่สอดคล้อง พรบ.พื้นที่นวัตกรรมการศึกษา","กลุ่มที่ 2: การพัฒนาวิชาชีพและหนุนเสริมศักยภาพครูผ่านกระบวนการนิเทศแบบร่วมมือ","2.1 หลักสูตรและสื่อการพัฒนาวิชาชีพครู (เช่น เอกสารประกอบการจัดเวิร์กชอป)","สื่อนำเสนอโครงการเวิร์กชอปเรื่อง ""การออกแบบการประเมินสมรรถนะของผู้เรียนโดยใช้วันไหว้ครูเป็นฐาน"" โดยศึกษานิเทศก์ รัชภูมิ สมสมัย มุ่งเน้นการเชื่อมโยงความรู้ ประสบการณ์ และชีวิตจริง เพื่อปรับเปลี่ยนแนวทางการวัดผลเชิงรุก","https://canva.link/omh9ht81j7x8g5g","","","","","","","","","","","","","","","","","","","","",""
"The Barista Leader ชงทักษะคนการศึกษาให้กลมกล่อมในโลก AI","กลุ่มที่ 2: การพัฒนาวิชาชีพและหนุนเสริมศักยภาพครูผ่านกระบวนการนิเทศแบบร่วมมือ","2.1 หลักสูตรและสื่อการพัฒนาวิชาชีพครู (เช่น เอกสารประกอบการจัดเวิร์กชอป)","สื่อนำเสนอโครงการเวิร์กชอปเรื่อง ""การออกแบบการประเมินสมรรถนะของผู้เรียนโดยใช้วันไหว้ครูเป็นฐาน"" โดยศึกษานิเทศก์ รัชภูมิ สมสมัย มุ่งเน้นการเชื่อมโยงความรู้ ประสบการณ์ และชีวิตจริง เพื่อปรับเปลี่ยนแนวทางการวัดผลเชิงรุก","https://canva.link/bbzc16519guglz4","","","","","","","","","","","","","","","","","","","","",""
"Active Learning / Innovators and Real life","กลุ่มที่ 2: การพัฒนาวิชาชีพและหนุนเสริมศักยภาพครูผ่านกระบวนการนิเทศแบบร่วมมือ","2.1 หลักสูตรและสื่อการพัฒนาวิชาชีพครู (เช่น เอกสารประกอบการจัดเวิร์กชอป)","สื่อนำเสนอโครงการเวิร์กชอปเรื่อง ""การออกแบบการประเมินสมรรถนะของผู้เรียนโดยใช้วันไหว้ครูเป็นฐาน"" โดยศึกษานิเทศก์ รัชภูมิ สมสมัย มุ่งเน้นการเชื่อมโยงความรู้ ประสบการณ์ และชีวิตจริง เพื่อปรับเปลี่ยนแนวทางการวัดผลเชิงรุก","https://canva.link/t6mtw5t86qzpgr6","","","","","","","","","","","","","","","","","","","","",""
"รวมเล่มการออกแบบกิจกรรมวิทยาศาสตร์ ป.6.pdf","กลุ่มที่ 4: การพัฒนาระบบนิเวศการเรียนรู้ดิจิทัลและเทคโนโลยีสารสนเทศเพื่อการนิเทศการศึกษา","4.1 เอกสารวิชาการและสื่อการเรียนรู้ดิจิทัลในรูปแบบไฟล์คงรูป (PDF/e-Book)","นวัตกรรมสื่อสิ่งพิมพ์ดิจิทัล (e-Book) ต้นแบบการใช้ Prompt Engineering ร่วมกับ AI (Gemini) ในการออกแบบแนวทางกิจกรรมการเรียนรู้และการประเมินผล ที่สอดคล้องกับตัวชี้วัดระหว่างทางและปลายทาง กลุ่มสาระวิทยาศาสตร์และเทคโนโลยี ชั้น ป.6 เพื่อเป็นไอเดียตั้งต้นให้ครูนำไปประยุกต์ใช้ในชั้นเรียน","https://drive.google.com/file/d/1oNuvQMJ0XB4U6GcRqKTcfSOHWAfDvarY/view?usp=sharing","","","","","","","","","","","","","","","","","","","","",""
"คลังวิเคราะห์ตัวชี้วัดบูรณาการและกิจกรรม","กลุ่มที่ 4: การพัฒนาระบบนิเวศการเรียนรู้ดิจิทัลและเทคโนโลยีสารสนเทศเพื่อการนิเทศการศึกษา","4.4 แพลตฟอร์มและระบบสารสนเทศอัจฉริยะบนเครือข่ายอินเทอร์เน็ต (Website/Dashboard)","ระบบสารสนเทศ Web-based Dashboard เพื่อการบริหารจัดการหลักสูตร โดยนำเสนอผลการวิเคราะห์และเชื่อมโยงตัวชี้วัดระหว่างทางและตัวชี้วัดปลายทาง (กลุ่มสาระฯ ภาษาไทย ชั้น ป.1) บูรณาการเข้ากับกิจกรรมและเทศกาลสำคัญตามปฏิทินตลอดปีการศึกษา ช่วยให้ครูผู้ออกแบบหน่วยการเรียนรู้สามารถสืบค้นและนำไปใช้จัดการเรียนการเรียนสอนได้อย่างเป็นระบบ","https://subject-activity-analysis-cmpeo.vercel.app/","","","","","","","","","","","","","","","","","","","","",""
"การประเมินรายงานการวิจัยในชั้นเรียน","กลุ่มที่ 2: การพัฒนาวิชาชีพและหนุนเสริมศักยภาพครูผ่านกระบวนการนิเทศแบบร่วมมือ","2.1 หลักสูตรและสื่อการพัฒนาวิชาชีพครู (เช่น เอกสารประกอบการจัดเวิร์กชอป)","สื่อนำเสนอประกอบการอบรมเชิงปฏิบัติการเพื่อยกระดับสมรรถนะบุคลากรในการทำวิจัยในชั้นเรียน โดยนำเทคโนโลยี AI มาเป็นเครื่องมือช่วยวิเคราะห์และประเมินผลงานวิจัย มุ่งเน้นการเปลี่ยนผ่านจากการทำวิจัยแบบดั้งเดิมสู่กระบวนการที่รวดเร็วและมีประสิทธิภาพสูงขึ้นเพื่อแก้ปัญหาผู้เรียนได้ทันท่วงที","https://canva.link/7cnl5n9ic0uspwk","","","","","","","","","","","","","","","","","","","","",""
"การจัดทำสารสนเทศภายในองค์กรการศึกษาโดยการประยุกต์ใช้ Looker Studio","กลุ่มที่ 2: การพัฒนาวิชาชีพและหนุนเสริมศักยภาพครูผ่านกระบวนการนิเทศแบบร่วมมือ","2.1 หลักสูตรและสื่อการพัฒนาวิชาชีพครู (เช่น เอกสารประกอบการจัดเวิร์กชอป)","","https://canva.link/1zfuesmpl66zjbb","","","","","","","","","","","","","","","","","","","","",""
"แนวทางการสร้างแบบประเมินคุณลักษณะนวัตกรนักเรียนระดับชั้นมัธยมศึกษาตอนต้น","กลุ่มที่ 2: การพัฒนาวิชาชีพและหนุนเสริมศักยภาพครูผ่านกระบวนการนิเทศแบบร่วมมือ","4.4 แพลตฟอร์มและระบบสารสนเทศอัจฉริยะบนเครือข่ายอินเทอร์เน็ต (Website/Dashboard)","หน้าแรกของระบบสารสนเทศ Web-based Application ""คลังวิเคราะห์ตัวชี้วัดบูรณาการและกิจกรรม"" ที่ออกแบบ Interactivity เชื่อมโยงระดับชั้น ป.1 - ม.3 และปุ่มเมนูเข้าถึงข้อมูลสำคัญ เช่น โครงสร้างปฏิทิน เทศกาล และตัวชี้วัด มุ่งเป้าเป็นศูนย์กลางให้ครูสืบค้นเพื่ออกแบบหน่วยการเรียนรู้ลดเวลาทำงานซ้ำซ้อน","https://canva.link/j1lduvyvakqzflh","","","","","","","","","","","","","","","","","","","","",""
"การออกแบบการประเมินผลการเรียนรู้ที่สอดคล้องกับชีวิตจริง","กลุ่มที่ 4: การพัฒนาระบบนิเวศการเรียนรู้ดิจิทัลและเทคโนโลยีสารสนเทศเพื่อการนิเทศการศึกษา","4.5 ห้องเรียนดิจิทัลและแพลตฟอร์มสื่อมัลติมีเดียออนไลน์ (Digital Classrooms, Video & Streaming Platforms)","แพลตฟอร์มคลังสื่อและกิจกรรมการเรียนรู้ดิจิทัล แยกตาม 8 กลุ่มสาระฯ และกิจกรรมพัฒนาผู้เรียน มีระบบสืบค้นแผนการจัดการเรียนรู้บูรณาการและวิดีโอประกอบการสอน มุ่งหวังให้เป็นห้องเรียนดิจิทัลต้นแบบสำหรับครูผู้สอนในการดาวน์โหลดและขยายผลเชิงพื้นที่","https://canva.link/by50xg363hzl5ry","","","","","","","","","","","","","","","","","","","","",""
"Storybook การวิจัยในชั้นรียน","กลุ่มที่ 4: การพัฒนาระบบนิเวศการเรียนรู้ดิจิทัลและเทคโนโลยีสารสนเทศเพื่อการนิเทศการศึกษา","4.5 ห้องเรียนดิจิทัลและแพลตฟอร์มสื่อมัลติมีเดียออนไลน์ (Digital Classrooms, Video & Streaming Platforms)","เป็นการนำเสนอแพลตฟอร์มห้องเรียนดิจิทัลและสื่อมัลติมีเดียออนไลน์เพื่อสนับสนุนการจัดกิจกรรมการเรียนรู้และการนิเทศทางไกล นวัตกรรมนี้ช่วยลดข้อจำกัดเชิงพื้นที่ เพิ่มความยืดหยุ่นในการเข้าถึงองค์ความรู้แก่ครูผู้สอน และเป็นเครื่องมือขับเคลื่อนการนิเทศในยุคดิจิทัลอย่างเป็นระบบ","https://classroom-storybook-portal.vercel.app/","","","","","","","","","","","","","","","","","","","","",""
