"File Name","Main mission","Sub mission","Academic Summary","Link sub folder","","","","","","","","","","","","","","","","","","","","",""
"รวมบทความนานาทัศนะการศึกษาฐานสมรรถนะ.pdf","กลุ่มที่ 1: การพัฒนานวัตกรรมและองค์ความรู้เฉพาะทางในการนิเทศการศึกษา","1.1 เอกสารวิชาการประเภท ""คู่มือและแนวทางการนิเทศ""","หนังสือรวบรวม 6 ทัศนะและมุมมองเชิงวิชาการด้านการออกแบบการศึกษาฐานสมรรถนะ ครอบคลุมทั้งด้านหลักสูตร การจัดการเรียนรู้ และการประเมินผลที่เน้นสถานการณ์รอบตัวผู้เรียน เพื่อเป็นแนวทางปฏิรูปห้องเรียน","https://drive.google.com/drive/folders/1rMBq7XiQFJBOZsH7W5O8Ys1MwdYDbU3K?usp=sharing","","","","","","","","","","","","","","","","","","","","",""
"รวมเล่ม data driven education.pdf","กลุ่มที่ 1: การพัฒนานวัตกรรมและองค์ความรู้เฉพาะทางในการนิเทศการศึกษา","1.1 เอกสารวิชาการประเภท ""คู่มือและแนวทางการนิเทศ""","คู่มือเชิงแนวคิดและกระบวนการสำหรับครูในการนำข้อมูลสารสนเทศมาใช้ตัดสินใจเพื่อพัฒนาคุณภาพการศึกษา (Data-Driven Decisions) ครอบคลุมการเก็บ วิเคราะห์ และรายงานผลเพื่อยกระดับผลสัมฤทธิ์อย่างเป็นระบบ","https://drive.google.com/drive/folders/1rMBq7XiQFJBOZsH7W5O8Ys1MwdYDbU3K?usp=sharing","","","","","","","","","","","","","","","","","","","","",""
"รวมเล่ม education taxonomy final.pdf","กลุ่มที่ 1: การพัฒนานวัตกรรมและองค์ความรู้เฉพาะทางในการนิเทศการศึกษา","1.1 เอกสารวิชาการประเภท ""คู่มือและแนวทางการนิเทศ""","เอกสารวิชาการจำแนกหมวดหมู่และอนุกรมวิธานสำคัญทางการศึกษา (เช่น Bloom, Marzano, Webb's DOK) เพื่อเป็นกรอบแนวคิดให้ครูนำไปประยุกต์ใช้ในการจัดพฤติกรรมการเรียนรู้และการสร้างข้อสอบวัดคิดขั้นสูง","https://drive.google.com/drive/folders/1rMBq7XiQFJBOZsH7W5O8Ys1MwdYDbU3K?usp=sharing","","","","","","","","","","","","","","","","","","","","",""
"รวมเล่ม ลุก รับ เรียน รู้.pdf","กลุ่มที่ 4: การพัฒนาระบบนิเวศการเรียนรู้ดิจิทัลและเทคโนโลยีสารสนเทศเพื่อการนิเทศการศึกษา","4.1 เอกสารวิชาการและสื่อการเรียนรู้ดิจิทัลในรูปแบบไฟล์คงรูป (PDF/e-Book)","นวัตกรรมการจัดการความรู้ (KM) ของศึกษานิเทศก์ในบทบาท ""นักเล่าเรื่อง"" ผ่านแพลตฟอร์มโซเชียลมีเดีย เพื่อเปลี่ยนผ่านความรู้ ""จากกระดาษสู่อากาศ"" หนุนเสริมให้ครูเกิดการเรียนรู้ร่วมกันแบบยืดหยุ่น","https://drive.google.com/drive/folders/1k0eNO-0kkMyYEvHbEJ12LLxqDdEujTCW?usp=sharing","","","","","","","","","","","","","","","","","","","","",""
"แนวทางการเขียนรายงานวิจัย ขั้นพื้นฐาน.pdf","กลุ่มที่ 1: การพัฒนานวัตกรรมและองค์ความรู้เฉพาะทางในการนิเทศการศึกษา","1.1 เอกสารวิชาการประเภท ""คู่มือและแนวทางการนิเทศ""","คู่มือและแนวทางวิชาการที่สกัดจากประสบการณ์ตรง เพื่อเป็นเข็มทิศนำทางให้แก่ครูผู้สอนระดับขั้นพื้นฐานในการเขียนรายงานการวิจัยในชั้นเรียนอย่างถูกต้องตามหลักเกณฑ์และเป็นระบบ","https://drive.google.com/drive/folders/1rMBq7XiQFJBOZsH7W5O8Ys1MwdYDbU3K?usp=sharing","","","","","","","","","","","","","","","","","","","","",""
"แนวทางการเขียนรายงานวิจัย ปฐมวัย.pdf","กลุ่มที่ 1: การพัฒนานวัตกรรมและองค์ความรู้เฉพาะทางในการนิเทศการศึกษา","1.1 เอกสารวิชาการประเภท ""คู่มือและแนวทางการนิเทศ""","เอกสารแนวทางการจัดทำและเขียนรายงานการวิจัยในชั้นเรียนที่ออกแบบมาเฉพาะสำหรับครูปฐมวัย เพื่อเป็นเครื่องมือในการสืบเสาะความจริงและแก้ปัญหาพัฒนาการเด็กอย่างเป็นระบบและเชื่อถือได้","https://drive.google.com/drive/folders/1rMBq7XiQFJBOZsH7W5O8Ys1MwdYDbU3K?usp=sharing","","","","","","","","","","","","","","","","","","","","",""
"รวมเล่ม AL 2568.pdf","กลุ่มที่ 1: การพัฒนานวัตกรรมและองค์ความรู้เฉพาะทางในการนิเทศการศึกษา","1.3 รายงานการวิจัยและพัฒนา (R&D) ในบทบาทศึกษานิเทศก์","รายงานการวิจัยเชิงสำรวจเพื่อสกัดและตรวจสอบองค์ประกอบและพฤติกรรมบ่งชี้ในการจัดกิจกรรม Active Learning ของครูผู้สอนจังหวัดเชียงใหม่ ปี 2568 เพื่อใช้เป็นกรอบมาตรฐานในการประเมินและนิเทศการศึกษา","https://drive.google.com/drive/folders/1UHau5Y_tZk2yz4wGd-EyCgdYwyLbOyIp?usp=sharing","","","","","","","","","","","","","","","","","","","","",""
"รวมเล่ม Canva v 2.pdf","กลุ่มที่ 4: การพัฒนาระบบนิเวศการเรียนรู้ดิจิทัลและเทคโนโลยีสารสนเทศเพื่อการนิเทศการศึกษา","4.3 คู่มือและรายงานการประเมินผลการใช้เทคโนโลยีดิจิทัล (สถิติการใช้งาน/คู่มือผู้ใช้ระบบ)","คู่มือเทคนิคการประยุกต์ใช้แพลตฟอร์ม Canva for Education สำหรับครูผู้สอน เพื่อการออกแบบการเรียนการสอน การสื่อสารในการนิเทศการศึกษา และการจัดกิจกรรมส่งเสริมทักษะการคิดขั้นสูงของผู้เรียน","https://drive.google.com/drive/folders/1_MewmqiZ2ca1qG0rkFYMKFbCIOVLA6b7?usp=sharing","","","","","","","","","","","","","","","","","","","","",""
"รวมเล่ม GDS.pdf","กลุ่มที่ 4: การพัฒนาระบบนิเวศการเรียนรู้ดิจิทัลและเทคโนโลยีสารสนเทศเพื่อการนิเทศการศึกษา","4.2 การพัฒนาระบบอัตโนมัติและเครื่องมือช่วยปฏิบัติงาน (การเขียนสคริปต์/โค้ด/ระบบอัตโนมัติ)","คู่มืออธิบายการใช้งาน Google Data Studio (GDS) แบบ Step-by-Step สำหรับผู้บริหารและครู เพื่อพัฒนาคุณภาพการศึกษาและระบบบริหารจัดการสถานศึกษาโดยใช้สารสนเทศและการขับเคลื่อนด้วยข้อมูล","https://drive.google.com/drive/folders/12npSm4gurZQZymD0KIj0syAIRYTQiEF1?usp=sharing","","","","","","","","","","","","","","","","","","","","",""
"รวมเล่ม Innovator to innovation final.pdf","กลุ่มที่ 1: การพัฒนานวัตกรรมและองค์ความรู้เฉพาะทางในการนิเทศการศึกษา","1.2 เครื่องมือการวัดและประเมินผลต้นแบบ","รายงานการวิจัยและพัฒนาเครื่องมือต้นแบบ ""แบบประเมินคุณลักษณะนวัตกร"" สำหรับนักเรียนชั้นมัธยมศึกษาตอนต้นในจังหวัดเชียงใหม่ โดยผ่านการตรวจสอบคุณภาพพฤติกรรมบ่งชี้ทั้ง 7 ด้านอย่างเป็นวิทยาศาสตร์","https://drive.google.com/drive/folders/1nE74WgwPM3qwR5Z9KMP_1XUyYnYfZFMu?usp=sharing","","","","","","","","","","","","","","","","","","","","",""
"รวมเล่ม LDS v.2.pdf","กลุ่มที่ 4: การพัฒนาระบบนิเวศการเรียนรู้ดิจิทัลและเทคโนโลยีสารสนเทศเพื่อการนิเทศการศึกษา","4.2 การพัฒนาระบบอัตโนมัติและเครื่องมือช่วยปฏิบัติงาน (การเขียนสคริปต์/โค้ด/ระบบอัตโนมัติ)","คู่มือการประยุกต์ใช้ Looker Studio (ฉบับปรับปรุงครั้งที่ 2) สำหรับผู้บริหารและครู เพื่อเปลี่ยนข้อมูลดิบให้เป็นแดชบอร์ดสารสนเทศอัจฉริยะ นำไปสู่การบริหารจัดการห้องเรียนและสถานศึกษาโดยใช้สารสนเทศเป็นฐาน","https://drive.google.com/drive/folders/12npSm4gurZQZymD0KIj0syAIRYTQiEF1?usp=sharing","","","","","","","","","","","","","","","","","","","","",""
"รวมเล่มทบทวนความรู้การวิจัยในชั้นเรียน.pdf","กลุ่มที่ 2: การพัฒนาวิชาชีพและหนุนเสริมศักยภาพครูผ่านกระบวนการนิเทศแบบร่วมมือ","2.1 หลักสูตรและสื่อการพัฒนาวิชาชีพครู (เช่น เอกสารประกอบการจัดเวิร์กชอป)","สื่อสรุปองค์ความรู้และแบบทดสอบทบทวนเรื่องการวิจัยในชั้นเรียน (ฉบับคนเริ่มต้น) เพื่อใช้หนุนเสริมสมรรถนะครูในการวิเคราะห์ปัญหาห้องเรียนและสร้างนวัตกรรมแก้ไขพฤติกรรมผู้เรียนได้อย่างเป็นระบบ","https://drive.google.com/drive/folders/1XTdr4mmlwkj8wnRVMpYYiECGwHSYoY4H?usp=sharing","","","","","","","","","","","","","","","","","","","","",""
"รวมเล่มแนวทางการเขียนรายงานการวิจัยในชั้นเรียน เอกชน.pdf","กลุ่มที่ 1: การพัฒนานวัตกรรมและองค์ความรู้เฉพาะทางในการนิเทศการศึกษา","1.1 เอกสารวิชาการประเภท ""คู่มือและแนวทางการนิเทศ""","คู่มือและแนวทางวิชาการที่ออกแบบมาจำเพาะสำหรับครูโรงเรียนเอกชน เพื่อใช้เป็นเข็มทิศและกรอบมาตรฐานในการเขียนรายงานวิจัยในชั้นเรียนให้ถูกต้อง น่าเชื่อถือ และสอดคล้องกับเกณฑ์การพัฒนาวิชาชีพ","https://drive.google.com/drive/folders/1rMBq7XiQFJBOZsH7W5O8Ys1MwdYDbU3K?usp=sharing","","","","","","","","","","","","","","","","","","","","",""
"Podcast การวัดและประเมินผลในชั้นเรียน","กลุ่มที่ 4: การพัฒนาระบบนิเวศการเรียนรู้ดิจิทัลและเทคโนโลยีสารสนเทศเพื่อการนิเทศการศึกษา","4.5 ห้องเรียนดิจิทัลและแพลตฟอร์มสื่อมัลติมีเดียออนไลน์","สื่อมัลติมีเดียสร้างความรู้ความเข้าใจพื้นฐานเกี่ยวกับความหมาย ลักษณะ และบทบาทสำคัญของการวัดและประเมินผลการศึกษา เพื่อวางกรอบแนวคิดที่ถูกต้องให้แก่ครูผู้สอน","https://www.youtube.com/playlist?list=PLUyZy8gE6N_blZX5anGIcirZKlUCrI3pq","","","","","","","","","","","","","","","","","","","","",""
"Podcast การวิจัยในชั้นเรียน","กลุ่มที่ 4: การพัฒนาระบบนิเวศการเรียนรู้ดิจิทัลและเทคโนโลยีสารสนเทศเพื่อการนิเทศการศึกษา","4.5 ห้องเรียนดิจิทัลและแพลตฟอร์มสื่อมัลติมีเดียออนไลน์","สื่อมัลติมีเดียสร้างความรู้ความเข้าใจพื้นฐานเกี่ยวกับความหมาย ลักษณะ และบทบาทสำคัญของการวิจัยในชั้นเรียน เพื่อวางกรอบแนวคิดที่ถูกต้องให้แก่ครูผู้สอน","https://www.youtube.com/playlist?list=PLUyZy8gE6N_YjftmsqIe7dDdA5sCt-YeM","","","","","","","","","","","","","","","","","","","","",""
"คลังสื่อวิดีโอพอดแคสต์","กลุ่มที่ 4: การพัฒนาระบบนิเวศการเรียนรู้ดิจิทัลและเทคโนโลยีสารสนเทศเพื่อการนิเทศการศึกษา","4.5 ห้องเรียนดิจิทัลและแพลตฟอร์มสื่อมัลติมีเดียออนไลน์","เป็นคลังสื่อนวัตกรรมการนิเทศทางไกล (Asynchronous Supervision) ที่บูรณาการองค์ความรู้ 3 มิติหลัก ได้แก่ กระบวนการวัดผลเฉพาะทาง (พหุปัญญา/O-NET) แนวทางการบริหารจัดการสถานศึกษาเพื่อรับการประเมินภายนอก และการสื่อสารนโยบายเชิงระบบ เพื่อให้ครูและผู้บริหารสามารถเข้าถึงคำแนะนำทางวิชาการได้ทุกที่ทุกเวลา","https://www.youtube.com/playlist?list=PLUyZy8gE6N_aknJFyCxvGRTojUvsqs02H","","","","","","","","","","","","","","","","","","","","",""
"เพลย์ลิสต์ Classroom Assessment Tip","กลุ่มที่ 4: การพัฒนาระบบนิเวศการเรียนรู้ดิจิทัลและเทคโนโลยีสารสนเทศเพื่อการนิเทศการศึกษา","4.5 ห้องเรียนดิจิทัลและแพลตฟอร์มสื่อมัลติมีเดียออนไลน์","เป็นคลังสื่อนวัตกรรมการนิเทศดิจิทัลในรูปแบบวิดีโอขนาดสั้น (Micro-learning) เพื่อพัฒนาวิชาชีพครูรายบุคคล มุ่งเน้นการให้ความรู้และแนวคิดกระชับ (Tips) เกี่ยวกับการบริหารจัดการระบบการวัดและประเมินผลในชั้นเรียน (Classroom Assessment) ความท้าทายด้านเทคโนโลยี และความฉลาดรู้ด้านการประเมิน (Assessment Literacy)","https://www.youtube.com/playlist?list=PLUyZy8gE6N_abHWKZ0pmSbEAr1-0hfpvg","","","","","","","","","","","","","","","","","","","","",""
"Assessment Talk","กลุ่มที่ 4: การพัฒนาระบบนิเวศการเรียนรู้ดิจิทัลและเทคโนโลยีสารสนเทศเพื่อการนิเทศการศึกษา","4.5 ห้องเรียนดิจิทัลและแพลตฟอร์มสื่อมัลติมีเดียออนไลน์","วิดีโอออนไลน์ที่ใช้ถ่ายทอดสดและบันทึกเทปการเสวนาทางวิชาการ มุ่งเน้นการยกระดับสมรรถนะครูและบุคลากรทางการศึกษา ด้านการวัดและประเมินผลการศึกษาขั้นสูง (EFA, CFA, Mplus) และการประยุกต์ใช้เทคโนโลยีดิจิทัล (Apps Script) เพื่อการบริหารและการนิเทศเชิงระบบ","https://www.youtube.com/playlist?list=PLUyZy8gE6N_aFrglHmzskoJVhL3skDMzz","","","","","","","","","","","","","","","","","","","","",""
"รวมเล่มการประยุกต์ใช้ solo และเทศกาล 3 เทศกาล.pdf","กลุ่มที่ 1: การพัฒนานวัตกรรมและองค์ความรู้เฉพาะทางในการนิเทศการศึกษา","1.2 เครื่องมือการวัดและประเมินผลต้นแบบ","นวัตกรรมการบูรณาการสมรรถนะหลัก 6 ด้าน ร่วมกับ SOLO Taxonomy และภาระงานฐานบริบท 3 เทศกาล เพื่อยกระดับความซับซ้อนเชิงพุทธิปัญญาตามช่วงวัย (ป.3 - ม.6) เปลี่ยนกระบวนทัศน์จากการตัดสินผลเป็นการประเมินเพื่อพัฒนาและการสร้างนั่งร้านการเรียนรู้ (Scaffolding)","https://drive.google.com/file/d/1kiY_0F2vlnmfBCdlFK_TTZHzxCFkNKZl/view?usp=sharing","","","","","","","","","","","","","","","","","","","","",""
"รวมเล่มการวิเคราะห์มาตรฐาน วิทย์ ป.6 เอกชน.pdf","กลุ่มที่ 3: การบริหารจัดการเครือข่ายและประสานความร่วมมือเพื่อการพัฒนาการศึกษาเชิงพื้นที่","3.3 รายงานผลการดำเนินงานเชิงระบบและสารสนเทศเพื่อการตัดสินใจของผู้บริหาร","รายงานสารสนเทศวิเคราะห์แนวโน้มผลทดสอบ O-NET 5 ปี (2563-2567) ของกลุ่มโรงเรียนเอกชนในจังหวัดเชียงใหม่ รายโรงเรียน เพื่อใช้ข้อมูลเชิงลึกเป็นรากฐานและจุดเริ่มต้นในการทำวิจัยในชั้นเรียน (Classroom Action Research) ในการขับเคลื่อนและยกระดับคุณภาพการศึกษาวิทยาศาสตร์","https://drive.google.com/file/d/10XPAWqftZnXRwO8Gc6bg_lPBMCyIeMi6/view?usp=sharing","","","","","","","","","","","","","","","","","","","","",""
"รวมเล่มคู่มือ NotebookLM.pdf","กลุ่มที่ 4: การพัฒนาระบบนิเวศการเรียนรู้ดิจิทัลและเทคโนโลยีสารสนเทศเพื่อการนิเทศการศึกษา","4.1 เอกสารวิชาการและสื่อการเรียนรู้ดิจิทัลในรูปแบบไฟล์คงรูป (PDF/e-Book)","คู่มือวิชาการแนวทางการประยุกต์ใช้แพลตฟอร์ม AI ""NotebookLM"" ภายใต้แนวคิด Source-Grounded AI เพื่อช่วยย่อยเอกสารหนาแน่น แปลงเนื้อหาเป็นแผนผังความคิด พอดแคสต์เสียง และคู่มือการเรียนรู้ ช่วยลดเวลาการทำงานวิจัยและเพิ่มประสิทธิภาพการจัดการความรู้ส่วนบุคคล","https://drive.google.com/file/d/1M_UUX5mXrQPDyXIhxF3tnfgwvg6Kx67M/view?usp=sharing","","","","","","","","","","","","","","","","","","","","",""
