"File Name","Main mission","Sub mission","Academic Summary","Link sub folder","","","","","","","","","","","","","","","","","","","","",""
"Storybook การวัดผลในชั้นรียน","กลุ่มที่ 4: การพัฒนาระบบนิเวศการเรียนรู้ดิจิทัลและเทคโนโลยีสารสนเทศเพื่อการนิเทศการศึกษา","4.5 ห้องเรียนดิจิทัลและแพลตฟอร์มสื่อมัลติมีเดียออนไลน์ (Digital Classrooms, Video & Streaming Platforms)","ชุดเอกสารแนวทางการทำวิจัยในชั้นเรียนที่แบ่งเนื้อหาเป็นเล่มย่อยแบบเบ็ดเสร็จ (เช่น นวัตกรรม, ประชากรและกลุ่มตัวอย่าง, การเก็บรวบรวมข้อมูล, การเขียนโครงร่าง) เพื่อเป็นคู่มือมาตรฐานให้ครูใช้แก้ปัญหาและพัฒนาการเรียนรู้ของผู้เรียนอย่างเป็นระบบ","https://classroom-storybook-portal.vercel.app/","","","","","","","","","","","","","","","","","","","","",""
"Claude ครูสร้างเว็บ","กลุ่มที่ 4: การพัฒนานวัตกรรมและระบบนิเวศการเรียนรู้ดิจิทัลและเทคโนโลยีสารสนเทศเพื่อการนิเทศการศึกษา","4.4 แพลตฟอร์มและระบบสารสนเทศอัจฉริยะบนเครือข่ายอินเทอร์เน็ต (Website/Dashboard)","แพลตฟอร์มการเรียนรู้และระบบสารสนเทศอัจฉริยะที่ช่วยยกระดับสมรรถนะครูในการสร้างเว็บสื่อการสอนและพอร์ตโฟลิโอ (วPA) ด้วย Claude AI โดยเป็นนวัตกรรมที่เปลี่ยนบทบาทครูจากผู้ใช้สื่อสู่การเป็น ""ผู้พัฒนาสื่อนวัตกรรมดิจิทัลปฏิสัมพันธ์"" ได้ด้วยตนเองโดยไม่ต้องเขียนโค้ด","https://claude-web-guide-for-teachers.vercel.app/","","","","","","","","","","","","","","","","","","","","",""
"รวมเล่ม school learning map final.pdf","กลุ่มที่ 3: การบริหารจัดการเครือข่ายและประสานความร่วมมือเพื่อการพัฒนาการศึกษาเชิงพื้นที่","3.3 รายงานผลการดำเนินงานเชิงระบบและสารสนเทศเพื่อการตัดสินใจของผู้บริหาร","เอกสารการจัดทำแผนที่การเรียนรู้ของโรงเรียน (School Learning Map) เชิงระบบ ที่รวบรวมสารสนเทศ ทิศทาง และผลการดำเนินงานของสถานศึกษาในเครือข่าย เพื่อให้ผู้บริหารและศึกษานิเทศก์ใช้เป็นฐานข้อมูลเชิงยุทธศาสตร์ในการตัดสินใจพัฒนาและนิเทศการศึกษาได้ตรงตามบริบทจริง","https://drive.google.com/file/d/1SyioEhFerADIJploYWUoaryqfFsGKeXs/view?usp=sharing","","","","","","","","","","","","","","","","","","","","",""
"ระบบคลัง Prompt for Antigravity 2.0 เพื่อการศึกษา","กลุ่มที่ 4: การพัฒนาระบบนิเวศการเรียนรู้ดิจิทัลและเทคโนโลยีสารสนเทศเพื่อการนิเทศการศึกษา","4.2 การพัฒนาระบบอัตโนมัติและเครื่องมือช่วยปฏิบัติงาน (การเขียนสคริปต์/โค้ด/ระบบอัตโนมัติ)","แพลตฟอร์มสารสนเทศเพื่อการขับเคลื่อนและบริหารจัดการชุดคำสั่ง (Prompt) ในระบบปัญญาประดิษฐ์ (AI) แยกกลุ่มผู้ใช้งานเป็นครูผู้สอน ผู้บริหาร และศึกษานิเทศก์ หนุนเสริมการทำงานเชิงอัตโนมัติและการสังเคราะห์งานวิจัยในชั้นเรียน","https://script.google.com/macros/s/AKfycbwsO5CN6GF8ErK69DDOFMOX71k_cDWGBUfeyY3lpvW648UArtIDgvavxiegCJwONlvt/exec","","","","","","","","","","","","","","","","","","","","",""
"คลังกิจกรรมการเรียนรู้ส่งเสริมพหุปัญญาล้านนา","กลุ่มที่ 4: การพัฒนาระบบนิเวศการเรียนรู้ดิจิทัลและเทคโนโลยีสารสนเทศเพื่อการนิเทศการศึกษา","4.4 แพลตฟอร์มและระบบสารสนเทศอัจฉริยะบนเครือข่ายอินเทอร์เน็ต (Website/Dashboard)","แพลตฟอร์ม Web application คลังนวัตกรรมการสอนระดับประถมศึกษา (ป.4-6) ที่บูรณาการ Soft Power ล้านนาเข้ากับพหุปัญญา มีระบบสืบค้นและคัดกรองกิจกรรม (Filter) ตามระดับชั้น บริบทท้องถิ่น และมิติพหุปัญญาหลัก เพื่อให้ครูผู้สอนเข้าถึงแผนการจัดการเรียนรู้และไอเดียการประเมินผลได้สะดวก","https://cm-mi-p4-p6.vercel.app/","","","","","","","","","","","","","","","","","","","","",""
"ระบบประเมินและเรียนรู้องค์ประกอบ Active Learning","กลุ่มที่ 4: การพัฒนาระบบนิเวศการเรียนรู้ดิจิทัลและเทคโนโลยีสารสนเทศเพื่อการนิเทศการศึกษา","4.4 แพลตฟอร์มและระบบสารสนเทศอัจฉริยะบนเครือข่ายอินเทอร์เน็ต (Website/Dashboard)","ระบบสารสนเทศดิจิทัล ""Active Learning @ CMPEO"" สนับสนุนการประเมินตนเองของครูและผู้บริหารในการขับเคลื่อนการจัดการเรียนรู้เชิงรุกเชิงพื้นที่ (เชียงใหม่ พ.ศ. 2568-2569) ประมวลผลจากงานวิจัยเชิงโครงสร้างสถิติเพื่อยกระดับขีดความสามารถการสอนอย่างยั่งยืน","https://active-learning-cmpeo.vercel.app/","","","","","","","","","","","","","","","","","","","","",""
"ครูพร้อมใช้ (AI Prompt Library)","กลุ่มที่ 4: การพัฒนาระบบนิเวศการเรียนรู้ดิจิทัลและเทคโนโลยีสารสนเทศเพื่อการนิเทศการศึกษา","4.4 แพลตฟอร์มและระบบสารสนเทศอัจฉริยะบนเครือข่ายอินเทอร์เน็ต (Website/Dashboard)","แพลตฟอร์ม ""ครูพร้อมใช้ (AI Prompt Library)"" คลังคำสั่งปฏิสัมพันธ์ (Prompt) สำหรับครูเพื่อใช้ AI เจนเนอเรชันสร้างสื่อการสอนและเครื่องมือประเมินสมรรถนะ/พหุปัญญาผู้เรียนรายบุคคล มีระบบแยกหมวดหมู่อาชีพ วัฒนธรรม และปุ่มคัดลอกโค้ดไปใช้ได้ทันที","https://sornorpoom.github.io/prompt-for-digital-art/","","","","","","","","","","","","","","","","","","","","",""
"คลังวิเคราะห์ตัวชี้วัดบูรณาการและกิจกรรม","กลุ่มที่ 4: การพัฒนาระบบนิเวศการเรียนรู้ดิจิทัลและเทคโนโลยีสารสนเทศเพื่อการนิเทศการศึกษา","4.4 แพลตฟอร์มและระบบสารสนเทศอัจฉริยะบนเครือข่ายอินเทอร์เน็ต (Website/Dashboard)","ระบบสารสนเทศ Web-based Dashboard เพื่อการบริหารจัดการหลักสูตร โดยนำเสนอผลการวิเคราะห์และเชื่อมโยงตัวชี้วัดระหว่างทางและตัวชี้วัดปลายทาง (กลุ่มสาระฯ ภาษาไทย ชั้น ป.1) บูรณาการเข้ากับกิจกรรมและเทศกาลสำคัญตามปฏิทินตลอดปีการศึกษา ช่วยให้ครูผู้ออกแบบหน่วยการเรียนรู้สามารถสืบค้นและนำไปใช้จัดการเรียนการเรียนสอนได้อย่างเป็นระบบ","https://subject-activity-analysis-cmpeo.vercel.app/","","","","","","","","","","","","","","","","","","","","",""
"รวมเล่มกิจกรรมพัฒนาพหุปัญญา ป.4-ป.6 ครูสร้าง final.pdf","กลุ่มที่ 1: การพัฒนานวัตกรรมและองค์ความรู้เฉพาะทางในการนิเทศการศึกษา","1.2 เครื่องมือการวัดและประเมินผลต้นแบบ","นวัตกรรมชุดเครื่องมือและกิจกรรมประเมินพหุปัญญา (Multiple Intelligences) ที่ผ่านการวิจัยเชิงระบบและสกัดพฤติกรรมบ่งชี้ให้สอดคล้องกับวิถีชีวิตและบริบททางวัฒนธรรมของจังหวัดเชียงใหม่","https://drive.google.com/drive/folders/1nE74WgwPM3qwR5Z9KMP_1XUyYnYfZFMu?usp=sharing","","","","","","","","","","","","","","","","","","","","",""
"ระบบสารสนเทศ School Learning Map","กลุ่มที่ 4: การพัฒนาระบบนิเวศการเรียนรู้ดิจิทัลและเทคโนโลยีสารสนเทศเพื่อการนิเทศการศึกษา","4.4 แพลตฟอร์มและระบบสารสนเทศอัจฉริยะบนเครือข่ายอินเทอร์เน็ต (Website/Dashboard)","ระบบสารสนเทศในรูปแบบ Web Application (Google Apps Script) แสดงผลในลักษณะ Matrix Dashboard เพื่อติดตามและกำกับสถานะการส่งภารกิจ/ชิ้นงานของนักเรียนจำแนกตามรายเดือนและระดับชั้น (ป.1 - ป.5) พร้อมระบบคัดกรองข้อมูล (Filter) และลิงก์ดาวน์โหลดชิ้นงานรายบุคคล ช่วยหนุนเสริมการนิเทศติดตามเชิงพื้นที่ได้อย่างเป็นระบบ","https://script.google.com/macros/s/AKfycbwUcxONWi80s_iuiN6Qzodt5nHw-LC0DhdgXCIPpED_Dmy7ZRX8UKn69cIMHeDMiImIgQ/exec","","","","","","","","","","","","","","","","","","","","",""
"Chiang Mai Tourism Poster Collection from teacher","กลุ่มที่ 4: การพัฒนาระบบนิเวศการเรียนรู้ดิจิทัลและเทคโนโลยีสารสนเทศเพื่อการนิเทศการศึกษา","4.4 แพลตฟอร์มและระบบสารสนเทศอัจฉริยะบนเครือข่ายอินเทอร์เน็ต (Website/Dashboard)","Web Application รูปแบบ Matrix Dashboard ติดตามสถานะการส่งภารกิจของครูและนักเรียนแยกตามรายเดือนและระดับชั้น (ป.1 - ป.5) พร้อมระบบ Filter คัดกรองและลิงก์ดาวน์โหลดชิ้นงานรายบุคคล หนุนเสริมกระบวนการกำกับติดตามและประเมินผลเชิงพื้นที่ได้อย่างเป็นระบบ","https://script.google.com/macros/s/AKfycbyFjb83q8KJs1j_xGOyM-j43BTTjStyhfB_xurWpDi2PhH-AX_jtJ8CSSamBqO5xxxU/exec","","","","","","","","","","","","","","","","","","","","",""
"Chiang Mai Tourism Poster Collection from student","กลุ่มที่ 4: การพัฒนาระบบนิเวศการเรียนรู้ดิจิทัลและเทคโนโลยีสารสนเทศเพื่อการนิเทศการศึกษา","4.4 แพลตฟอร์มและระบบสารสนเทศอัจฉริยะบนเครือข่ายอินเทอร์เน็ต (Website/Dashboard)","ระบบสารสนเทศ Web Application (Google Apps Script) รูปแบบ Matrix Dashboard แสดงสถานการณ์ส่งภารกิจแยกรายเดือนและระดับชั้น (ป.1 - ป.5) พร้อมระบบคัดกรองตัวเลือกหลักและลิงก์ดาวน์โหลดชิ้นงานรายบุคคล ช่วยหนุนเสริมการติดตามและประเมินผลสัมฤทธิ์เชิงพื้นที่","https://script.google.com/macros/s/AKfycbxIySS85ZhJ0gJ66asQDTU2hhWG-3OMAqZJxaZNp8b2hMEXiVY2xjgWH2DsJyzIs9cYsg/exec","","","","","","","","","","","","","","","","","","","","",""
"คลังฐานข้อมูลนวัตกรรมและรายงานการวิจัยในชั้นเรียน","กลุ่มที่ 4: การพัฒนาระบบนิเวศการเรียนรู้ดิจิทัลและเทคโนโลยีสารสนเทศเพื่อการนิเทศการศึกษา","4.4 แพลตฟอร์มและระบบสารสนเทศอัจฉริยะบนเครือข่ายอินเทอร์เน็ต (Website/Dashboard)","หน้าแรกของระบบสารสนเทศ (Main Platform Interface) แพลตฟอร์มบูรณาการสื่อดิจิทัลและการศึกษาเชิงพื้นที่ มีระบบสมาชิก สถิติจำนวนผลงานแยกรายอำเภอในจังหวัดเชียงใหม่ และส่วนแสดงผลงานเด่นเพื่อสร้างแรงบันดาลใจในการเรียนรู้","https://script.google.com/macros/s/AKfycbzQcL0qvQ2_YFSO5xc8JTFujJPqUPqbIKUrdT_JqR_dzOUvH15ux8WJxKgrq7AVda8O/exec","","","","","","","","","","","","","","","","","","","","",""
"Chiangmai School Learning Map การยกระดับเส้นทางการเรียนรู้ด้วยวิถีบริบท","กลุ่มที่ 1: การพัฒนานวัตกรรมและองค์ความรู้เฉพาะทางในการนิเทศการศึกษา","1.1 เอกสารวิชาการประเภท ""คู่มือและแนวทางการนิเทศ""","คลังแผนการจัดการเรียนรู้บูรณาการเชิงนวัตกรรม ภายใต้โครงการ ""Chiangmai School Learning Map"" ระดับชั้น ป.1 - ม.3 ที่ใช้แนวคิดเชิงพื้นที่ (Place-based/Contextual) บูรณาการ 8 กลุ่มสาระ อัตลักษณ์ท้องถิ่น และเทคโนโลยี ขับเคลื่อนด้วยกระบวนการ Active Learning และการประเมินตามสภาพจริง (Authentic Assessment)","https://drive.google.com/file/d/1BCJDNKSUoyERTM6rmAc0Vj3OUJvyAoml/view?usp=sharing","","","","","","","","","","","","","","","","","","","","",""
